{
  "name": "computer-use",
  "version": "1.0.0",
  "description": "电脑操作插件 - 提供浏览器自动化和桌面操作能力",
  "author": "MyAgentPlugin",
  "scripts": {
    "install": "npm i -g open-browser-use && open-browser-use setup"
  },
  "mcpServers": {
  },
  "skills": [
    {
      "name": "open-browser-use",
      "source": "iFurySt/open-browser-use",
      "description": "浏览器自动化操作"
    }
  ]
}
