{
  "name": "computer-use",
  "version": "1.0.0",
  "description": "电脑操作插件 - 提供桌面操作能力",
  "author": "MyAgentPlugin",
  "scripts": {
    "install": "npm i -g open-computer-use"
  },
  "mcpServers": {
    "open-computer-use": {
      "command": "open-computer-use",
      "args": [
        "mcp"
      ]
    }
  },
  "skills": [
    {
      "name": "open-computer-use",
      "source": "iFurySt/open-codex-computer-use",
      "skill": "open-computer-use",
      "description": "电脑自动化操作"
    }
  ]
}
