{
  "name": "enhance-dev",
  "version": "1.0.0",
  "description": "agents 插件 - 提供多 Agent 开发协作能力",
  "author": "MyAgentPlugin",
  "scripts": {
  },
  "mcpServers": {
  },
  "skills": [
    {
      "name": "enhance-dev",
      "source": "superproxy/skills",
      "description": "agents 插件 - 提供多 Agent 开发协作能力"
    }
  ]
}
